commercial_id,title,transcription,log_prob
NdrTGpICENs,"Spot natalizio ""Sky"" - 2010","Ugo... Buon Natale! Ah! Non te l'aspettavi, eh? Ah! Ugo! Quanto sei felice! Ah! Abbracciamoci come due koala! Mi vuoi bene? Lo so, ma sono un uomo sposato! Ugo, ti voglio bene? Questo Natale c'è Sky Christmas Box Cinema e più di 60 canali a 29 euro al mese Il calcio è il regalo! Regalati Sky e Sky ti regala il calcio Fiorcano calciatori! Sei contento? C'hai la lagrimuccia! Ugo... Buon Natale! Ah! Ah! Abbracciamoci come due koala! Questo Natale c'è Sky Christmas Box a 29 euro al mese Regalati Sky e Sky ti regala il calcio",-0.2812220083700644
Ng5sfTJSErU,"Spot ""Renault Twingo Diabolika"" (2002)",Y release Per l'inutile nuova collezione insospettabilmente diabolica.,-3.975316365559896
NHHa9T4XHfE,Armani Code 2005-2009 (profumo),Armani Code,-0.6064016421635946
nJkEu9fck0k,Dolci Preziosi - Spot Natale (2017),Dolci Preziosi Spot Natale Dolci Preziosi Spot Natale,-0.932536760965983
NMhm4xjKTdI,"ADV POMPEA  - ""Scelta di Donna"" - 2000","NUOVE CALSE POMPEA  -""Scelta di Donna"". Sottotitoli creati dalla comunità Amara.org",-0.526601927621024
NmKViegqoyY,Spot adidas maglia Nazionale di Calcio 2023,"Sottotitoli creati dalla comunità Amara.org Dicono che il futuro appartenga ai giovani, ma la passione non ha età. Vai dove ti porta. Sottotitoli creati dalla comunità Amara.org Che tu lo voglio o meno, devi andare avanti. Begheissima. Begheissima. Fortunatamente però, la strada continua e guarda il futuro.",-0.2572143031101601
nnhBvSeau3s,Spot Volkswagen Golf 6 - Born with experience - 2010,"Sweetheart, it may not be easy But we're trying hard to hold on Trying to make it better Sweetheart, you get so much freedom But freedom is just another word I said baby, set my soul on fire I've got two little arms to hold on tight And I wanna take higher Baby, I'm just a shoot, baby",-0.42461557388305665
No5txUhYp2M,Volkswagen Golf Spot 2000 (PUB ITA),It is a beautiful picture que It is a bижу It is pretty Pretty Beat Tu först Auf Klaינו Coming ник funny Na du We five Hams Lou Hams .,-5.281582641601562
nsb_Kgpr0Qg.s16,profumo Eternity Calvin Klein,Il tempo non ci toca Eternity Calvin Klein,-0.88958740234375
nsb_Kgpr0Qg.s2,profumi Dolce & Gabbana,Oh,-1.1976677179336548
nsb_Kgpr0Qg.s20,ovetti natalizi Kinder Sorpresa,certo mamma ma non comprare dei dolci qualsiasi per i ragazzi a natale ne ricevono tanti piuttosto qualcosa di buono fatto apposta per loro per esempio kinder ho visto delle confezioni veramente splendide e sì che emozione sotto l'albero con kinder sorpresa e che magia con kinder cioccolato una festa e il cioccolato e kinder anche natale tutti felici con kinder,-0.18576468673406862
nsBgz4JNh4M.s37,solari OlioSole Bilboa Cadey,OliolioSole Bilboa Cadey,-0.7655778249104818
nTqQpZdAl_w.s13,Coca Cola,"A shout, a blast, it's a flight, it's a fall A face in the crowd, it's having it all It's making the day, it's the time of the day It's a rip, it's a war, you got something to say It's a side of me, I want you now, it's for real You can't beat how it feels, it's a call, Coca Cola is it",-0.3100001355434986
nTqQpZdAl_w.s40,succhi di frutta Skipper Zuegg,"Hej, Propagno!",-4.689298629760742
NX8lOzSVv3o,Calzedonia Summer 2021,"Sunshine, we're living it up in sunshine",-0.8158038457234701
NxODKqbvqhE,My Sky. Mai più senza - REGISTRA - Nuovo Spot TV Sky,"Mi serve una casa per mezzanotte. E raccomando, niente dolci. Papà, mi puoi registrare il film, per favore? Sì, sì, sì. Grazie. Ciao, amore. Ciao. Registri, amore loro, sì. Si, stia ciao, Fisto. Sì, questo lo sapevo, sì, sì. Anche a questo serve My Sky. Registri i tuoi programmi preferiti e li vedi quando vuoi. Semplice. My Sky. Mai più senza. Registri, amore.",-0.2720635903848184
NZ7E_ljv8_8,3° spot Sky estate 2008 - Kakà Toni Chiellini Castell'Alfero,2° spot Sky estate 2009-Kakà Toni Chiellini Sky estate 2009-Kakà Toni Chiellini,-0.8439243541044348
o_VlvJ6lxqg.s15,deodoranti Malizia Uomo Mirato,Malizia Uomo Mirato,-0.617220401763916
o_VlvJ6lxqg.s9,Coca Cola,Enn-dor! Coca Cola Arg! Eddardo !,-3.477215358189174
O4ciRgeLM84.s10,Summer Card 95 Omnitel,Summer Card 95 Omnitel,-0.5075535244411893
O4ciRgeLM84.s65,Mobilebusiness Siemens,"Oh, scusi! Servono nuovi clienti. Rendete mobile il vostro business.",-0.8605525758531358
O9U78fT-Zmo,Spot SKY Promo Eroe 2007,"Sai quante cose puoi avere ogni giorno per un euro? Puoi avere news 24 ore su 24, tanto divertimento per i più piccoli, avventure e documentari, ben 7 canali di grande sport, 7 film diversi ogni sera tra cui scegliere. Oggi per meno di un euro al giorno puoi avere tutto lo sport o il grande CinemaSky. Chiama subito 1 99 10 900. Sottotitoli creati dalla comunità Amara.org",-0.2057491043238964
oa85U1CFJdI.s17,Campari,"Please come back to me, oh fantasy I'm in love with you, our music Please come back to me, oh fantasy Campari is fantasy",-0.5666204634166899
oa85U1CFJdI.s18,biancheria letto Zucchi,tra punte zucchi pensa zucchi tra punte zucchi belle di giorno morbide di notte pensa,-0.9114945151589133
oa85U1CFJdI.s9,brandy Vecchia Romagna Etichetta Nera,"Tua, sinceramente, Vecchia Romagna, Vecchia Romagna",-0.7736057043075562
obgKnelAVh8,Spot 2007 - Lancome - Hypnose Homme - Clive Owen (profumo),Spot 2007 Lancome I won't make you fall in love I won't see you die Hypnose Homme The new fragrance for men. Lancome.,-0.6091705322265625
oC3pRT6-gCQ.s14,stuzzicadenti Samurai Sisma,"Samurai, lo stuzzicadenti famosi. Samurai, lo stuzzicadenti famosi.",-0.6019572575887044
ockI1KMEs9M,"Spot Volkswagen Golf ""Sport Edition"" - 2011",Sottotitoli e revisione a cura di QTSS,-0.5006090799967448
OdHIJoNDgdU,"calzedonia  spot 2011  60"" Director's cut",Daughter Joyszczak meets reunion Tummy,-5.912171427408854
odtDzmx4tUo.s6,birra Bud,,
odtDzmx4tUo.s8,Campari Soda,"Campari Soda, pronto a chitto!",-0.7965158315805289
OevtZE5nT6o.s7,tonno Mareblu Simmenthal,Sognare nel blu il rosa di mare blu Solo dopo il mare più blu il tonno è più rosa solo Mareblu e rosa di mare,-0.49261324746268137
ofVOaPK4V_s.s17,tv e hi-fi Philips Match Line,più video più audio Philips Match Line,-0.7886059284210205
ohdGuY6StV8.s10,Gala Caffè,Gala Caffè insieme come un paese Gala per magia,-0.9129833493913923
o-qbbSI4ldQ,Pastiglie Leone 1857 lancia il suo primo spot tv: ecco il teaser,hacen,-4.712488174438477
othnElomj0E,"Spot ""Tim"" (con Kasia Smutniak - 2003)","Spot Che bella è quella? Ti è una bella pensata? Spot No! Fermo! Se la persona che cerchi ha il telefonino spento non è raggiungibile, premi 5 e un sms ti dirà quando richiamare. Not alone! Chiamare ora, è solo Tim. Nonna! Sono qui! Nonna, sono tutti inudisti! Signorina Uda e Avadero Babbo",-0.5377676645914714
OtRVa13NsSk,Spot  Sky Christmas 30sec  2009,Sottotitoli creati dalla comunità Amara.org,-0.26150212568395276
OV1p7Cuv5eg.s16,negozio di computer Computer Center - Roma,Prendi un computer per risolvere i tuoi problemi. Prendi quello più idoneo all'uso che puoi fare. Computer Center Il primo computer shop di Roma. Esperti analisti e programmatori a tua completa disposizione. Computer Center Per scegliere insieme il tuo elaboratore. Computer Center La più bassa gamma di computer per una scelta migliore. Computer Center All'altezza dei tuoi problemi. Computer Center Per scegliere il tuo lavoro. Computer Center Computer Center All'altezza dei tuoi problemi.,-0.3130480537951832
OV1p7Cuv5eg.s18,fiera RomaUfficio,fiera RomaUfficio,-0.9818351533677843
OwpDVMZtYCQ,Nuovo Toyota C-HR,"We've come a long long way together To the hard times and the good I have to celebrate you baby I have to praise you like I should You're so rare, you're so fine I'm so glad that you're mine I have to praise you I have to praise you I have to praise you like I should",-0.1711390177408854
owrmi0VWPtI.s6,pelletterie Conbipel (frammento),Pelle bellissima Conbipel Pellizia bellissima Conbipel Pelle bellissima Conbipel Pellizia bellissima Conbipel Pelle bellissima Conbipel Conbipel è acconato Dasti Produzione vendita,-0.5332671215659693
Ox4q3NLmqNw,SPOT Chronotech Shock your time 2008,Chronotech,-0.9805073738098145
OxmvKZ7uUwQ,"Spot ""Peugeot"" (2001)",Sottotitoli e revisione a cura di QTSS Sottotitoli e revisione a cura di QTSS,-0.5108574761284722
OxpIU5WvUiY,Lo spot di Telepass con Roberto Mancini,,
oz6v65AKFuw,Nintendo DS - Touch Me! - Seconda Pubblicità Italiana (2005),Nintendo DS Nintendo DS,-0.7409244378407797
ozDJcZwsNY0.s6,promozione turistica Turchia,Tu es Turquía,-0.6071617007255554
P12gltA6A9M,Zaini invicta spot pubblicità 2020,Zaini invicta spot pubblicità 2020 Zaini invicta spot pubblicità 2020,-0.5275758334568569
P6NNMwo-GWI.s23,orologi Maurice Lacroix,Egyébként gondolttalka lelent van Nino Feat Hubl attain paranoidρα Maurice Lacroix Csak egy fittedelő,-4.138386317661831
P6NNMwo-GWI.s27,Punt e Mes Carpano,Punt e Mes Carpano,-0.4202571868896484
Pad2jTLHBZc.s7,peluche Trudi,"una a te, una a me per essere felici di stare insieme insieme con te in carezza di Trudi Trudi il piccolo grande amore",-0.6777436516501687
paXMO9VsFAI.s23,Honda Civic 5 porte (♪ Musica: Carolyn's fingers - Cocteau Twins ♪),Dov'è Vittorio? Dov'è Vittorio? Dov'è papà? Dov'è Vittorio? Dov'è Vittorio? Nuova Honda Civic 5 porte E dove è Vittorio? Dove gli altri non arrivano? Buona notte!,-0.1442979138071944
paXMO9VsFAI.s29,yogurt Parmalat,Felirat tománk whole family A A A A A A A A A A A A A A,-3.494804927280971
PdoULo6g3CE,Nuova Lancia Ypsilon Black and Noir,"I see a red door I want it painted black I have to turn my head until my darkness goes I see a line of cars and they're all painted black Black and Noir, maybe it just happens everyday Nuova Ypsilon Black and Noir",-0.3211225782121931
PHW2jFf-fX8,Sky Spot Natale 2011 15sec,Sky Cinema HD,-0.7497882048288981
pjlRJnCNABQ,D&G Time - spot natale 2008,D&G Time,-0.5817270960126605
pKA8qxazKXY,Pubblicità Anni 2000 - Danone Yogurt - 2004,Danone Yogurt Danone Danone Yogurt,-0.6458134121365018
PKHb7COHuiE.s22,usato Renault ORO,"Con Floragel Nasce l'organizzazione Renault Occasioni usato tutte marche al giusto prezzo, selezionato, controllato e garantito sulle parti meccaniche Organizzazione Renault Occasioni speciali condizioni di credito di lancio e ogni informazione presso tutti i concessionari Renault",-0.3320524806068057
PKHb7COHuiE.s23,profumo Cacharel Pour l'Homme,Partie 1 Au de toilettes Cacharel pour l'Homme.,-0.8504318055652437
PKHb7COHuiE.s30,propaganda elettorale DC - Democrazia Cristiana,è 30 anni che nella mia città i comunisti promettono promettono e invece adesso basta le giunte rosse sono proprio giunte alla fine si basta con l'inefficienza la corruzione gli sperpe il pc non ha certo le carte in regola per governare l'italia se il pc va avanti l'italia va indietro italia merita fiducia dai fiducia alla dc 12 maggio vota democrazia cristiana,-0.2113784592727135
PKHb7COHuiE.s48,succhi G,Sfrutta la frutta! Sfrutta la frutta dei succhi G,-0.7904135097156871
PKHb7COHuiE.s8,mensile Ciak,"then, will you listen. तिसानंग對對 तिसानग भीत Marvel तिसानग तीफ смотреть ''चक् छाइस garder iki",-3.2155142890082464
PL0Z_dedxCU,Pubblicità Tim Tribù 2006,"da 99 euro. Corrado, vieni a corsa! Avvieni con la moto? Capirei, ecco dove ti vieni. Eccomi comandante, stai bella a Tribù? Eh sì, stai da aspettare a te. Corrado, sono tre ore. Comandante, siamo a Roma, c'è il traffico, non sono mica Valentino Rossi. No. Non mi piace neanche quello là, io tengo per viaggi.",-0.38325784301757815
pRpEvUY7PaM.s25,Twix,questione di mix,-0.745542049407959
pRpEvUY7PaM.s34,Volkswagen Polo,"Volkswagen Polo, nessun compromesso.",-0.5243374109268188
pRpEvUY7PaM.s45,Multicentrum,ogni giorno.,-0.42630434036254883
pRpEvUY7PaM.s46,Jeep Cherokee,मुश्चि Software मुष्चि Software,-2.0994111633300783
pRpEvUY7PaM.s52,snack Dixi & Co. San Carlo,Marstell bland How do you feel about the holiday guests? Oh my god! Sign here.ulent.de,-4.232703526814778
pRpEvUY7PaM.s55,Coca Cola (♪ Musica: Chihuahua - Dj Bobo ♪),UXyle Ensemble cases Chihuahua Chihuahua Chihuahua Chihuahua Chihuahua Chihuahua She only,-2.1151248039083277
pRpEvUY7PaM.s61,promozioni Wind,Waiting in plane,-4.951324462890625
pRpEvUY7PaM.s85,Mini,Zula,-0.7835697174072266
Pt7TZn_7mTs.s13,profumo Excess Pour Homme Paco Rabanne,Excess pour Homme Paco Rabanne Paris,-0.4185526371002197
Pt7TZn_7mTs.s16,profumo Sport Extreme Sergio Tacchini,la vita Fode e toalette Sergio Tacchini Sport Extreme,-0.838220897473787
pWXud4M_13A,Lacoste profumi (2004),budget Saluce Sc collagen La Ros arise La Up,-6.0005682082403276
pYAM8QGnyCs,ARMS - spot con Mara Maionchi e Gianluigi Donnarumma (Nintendo Switch),ARMS solo su Nintendo Switch,-0.8064462343851725
Q0IskBGGWvI.s5,pneumatici Michelin,"Michelin, le migliori performance sono quelle che ci portano alla nostra vita.",-0.9923193671486594
q1F6CwlwY_U,"Nuova FIAT 500 2015, Spot TV - New Fiat 500 Commercial",FIAT 500 FIAT 500 FIAT 500 FIAT 500 FIAT 500 FIAT 500 FIAT 500 FIAT 500 FIAT 500 FIAT 500 FIAT 500,-0.5736003518104553
q9Zg9daAXEc,Spot Sky Calcio Stadio 2004,"Stadio di Stadio 300 persone di là, 300 sul calcio, 200 su il porto, unire il calcio! Viva! Buongiorno, sono stato qui. Per me? Il suo stadio. Tutti quei carmi onari dove li mettiamo? Lo mettiamo dentro. Ma stai scherzando? No, non stai scherzando. Ti stiamo portando il grande calcio. Sky ti sorprende sempre.",-0.6890328790723663
Qa8SRIoHtXo.s21,Coca Cola,"Ciao! Che belle! Vuoi una Coca Cola? Ah ah! Grazie! Dai, dammi la mia Coca Cola! Sensatione unica",-0.6514849943273208
Qa8SRIoHtXo.s7,Peugeot 405,Peugeot 405 Peugeot 405,-0.5754922760857476
Qa8SRIoHtXo.s9,Fiat Uno,Fiat Uno Fiat Uno,-0.8380147616068522
qBXVAxiaJQo,Spot Pubblicita Sky   Italia1 2003,I I I I I I I I I I I I I,-0.6784963105854235
qDi6NkAgor4,Spot _ Microsoft Xbox (2002),"主制的,两位选手正在一来一往,好,一个投球,好,好,真正好,真正好好,好,好,好,好,好,好,好,好,好,好,好,好,好,好,好,好,好,好,好,好,好,好,好,好,好,好,好,好,好,好,好,好,好,好,好,好,好,好,好,好,好,好,好,好,好,好,好,好,好,好,好,好,好,好,好,好,好,好,好,好,好,好,好,好,好,好,好,好,好,好,好,好,好,好,好,好,好,好,好,好,好,好,好,好,好,好,好,好,好,好,好,好,好,好,好,好,好,好,好,好,好,好,好,好,好,好,好,好,好,好,好",-0.4869941605461968
QEEm76sff6M,Spot Sky - Toni Mondiali 2006,Sottotitoli creati dalla comunità Amara.org Sottotitoli creati dalla comunità Amara.org,-0.3230966399697697
qEHfkge2Voo.s1,Rover 800,bisogna credere in valori nuovi per costruire un'auto come questa modellata su un esemplare in carbonio perché ogni pezzo si è perfetto sospinta da 180 cavalli di un 2.000 turbo 16 valvole concepita per garantire il confort e la massima sicurezza dei passeggeri Rover 800 alla guida di valori nuovi. Rover un'altra classe,-0.1679189291345068
qFKULg-10hs.s16,Coca Cola Light,Pesco,-0.9892832438151041
qFKULg-10hs.s20,Vodafone Live UMTS (♪ Musica: Lift me up - Moby ♪),"Vidi la magia! Segui i tuoi programmi preferiti! Con Vodafone Live UMTS, la televisione è tutta intorno a te! Vidi la magia!",-0.31203770637512207
qFKULg-10hs.s6,orologi Festina,Attraction is a universal feeling,-0.4641146659851074
qFZhu0Kj59s.s15,birra Beck's,"Cappuri, l'emozione di un gusto incompondibile. Button",-0.9095363616943359
qFZhu0Kj59s.s17,Fernet Branca,"2000 Brett Branca, character dominante.",-3.4012683868408202
qFZhu0Kj59s.s25,uova di Pasqua Bauli,la festa è molto alta,-0.8019575476646423
qFZhu0Kj59s.s27,deodorante Lycia Persona,Lycia Persona non ti tradisce mai,-0.31186272700627643
qFZhu0Kj59s.s46,RasBank,Thanks for watching!,-0.766458443232945
qFZhu0Kj59s.s49,"ricaricabili Omnitel-Vodafone (con Megan Gale, ♪ Musica: Sky - Sonique ♪)","La promozione continua, fino al 7 aprile le carte ricaricabili Omnitel costano la metà.",-0.3189038922709803
qFZhu0Kj59s.s52,Alfa Romeo 147 5 porte,बुणिको बुणिको,-0.9263696670532227
qFZhu0Kj59s.s7,Audi A2,Fancy Audi A2 Fancy,-0.8010690689086915
QGAdpIvAaRA,Spot Pubblicita Swiffer   La7 2011,"Perché continua a tornare? Pensavo di essermi liberata di te! Stanca della polvere che ritorna così presto? Scopri il nuovo sistema Swiffer! Swiffer cattura la polvere nel suo panno elettrostatico. Rispetto alle scopie tradizionali che sollevano la polvere, Swiffer ne cattura il doppio. Addio polvere con Swiffer! Swiffer dura fino a due volte più a lungo rispetto ai prodotti non di marca. Provalo, conviene! Sottotitoli creati dalla comunità Amara.org",-0.2533631832041639
qGxGIxs6Rf4,Spot OPEL CORSA - Canale 5 - 20 MAGGIO 2007,"Non restare alla finestra! Regalati un nuovo modo di guidare grazie all'ESP+, il più avanzato sistema di controllo elettronico della stabilità. La maxi sfida OPEL ti aspetta! Nuova Opel Corsa da 9.850 euro con climatizzatore, prezzi bloccati. E in più, ti regali l'ESP+, solo a maggio, dai concessionari OPEL. Porte aperte sabato e domenica. www.mooji.it",-0.15917081681508866
qI6VEpzHQ-M,Spot Fiat 500x 2016,Spot Fiat 500x 2016,-0.7957219547695584
qIbSh2ox8PA.s4,settimanale Gioia,"Gioia, Gioia di tutto! E questa settimana Gioia diventa speciale, speciale e moda!",-0.48818973132542204
QjXNUqoWRr0,Spot Sky HD : La città allagata,"Adesso si ne suonerà in chiara. Reggiti, reggiti. Ti fiditi di me. Ti fido di te. In HD le emozioni sono più forti. Vivile solo con il cinema di Sky. Questa è TV. Questo è Sky HD. Chiama 02 70 70. Sottotitoli creati dalla comunità Amara.org",-0.3499477126381614
QKb9suPYvtk.s9,cioccolato Nestlè,"Nestlè ! अब चञी t grinder तो हो का � Только announced और priet खो zijn बगा Mittel ऌ��ी आजा � liked ऐय viaje वो लोग रर dedic Russia पर अकषा हमां इस इसा अपना Gaussian जा either Nestlé, Amore e Cioccolato",-3.48381884765625
QKkddFQyzPw.s7,Mystic Knights of Tir na Noc Giochi Preziosi,"Mystic Knights di Tir na Noc Ice Lord, Signore del Viaggio con la sua amicidiale testa da riete, attacca i quattro cavalieri, ma i Mystic Knights rispondono con la catapulta Ice Storm, al loro fianco Fire. Mystic Knights di Tir na Noc Giochi Preziosi Mystic Knights di Tir na Noc Giochi Preziosi",-0.29933282307216097
QNn5-jARDFc,Spot - Miracle Baby TESORO MIO Mattel - 2001,TESORO MIO Sottotitoli creati dalla comunità Amara.org,-0.4064048131306966
qnqcz2rcoeA,PlayStation 4 - Best Games - Spot TV Ita (2014),"Questo è per chi il gioco lo vive. Per chi vuole entrare in azione. Questo è per i giocatori. Per i soldati che, uniti, si sentono più forti. Questo è per chi nasconde tra le mani un potere straordinario in ma paura di usarlo. I migliori giochi sono su PS4. Sottotitoli creati dalla comunità Amara.org",-0.2197003072621871
QO640zHiETQ.s14,promozione turistica Toscana,in Piemme,-0.963465690612793
qotGwthXdJA,2004 Pubblicità Rai Due - Sunsilk Duo Keratins,LV,-2.5694252014160157
QQu4jQ-tXRs,Spot TV Rosato Gioielli 2016 - Icone Bags,"A volte le parole non servono, le emozioni, attraverso piccoli gesti ed espressioni impergettibili, riescono ad esprimersi in silenzio.",-0.3535065460205078
QsbqCPLnnV8.s8,Beltè Vera,Da Nestlé,-0.8427175680796305
Qt0Nvj5-Wp4.s35,trapunte Zucchi,Zucchi! Pensa! Zucchi! Zucchi! Zucchi! Zucchi! Pensa! Zucchi! Più calda la notte Pensa! Zucchi!,-0.5800923903783163
Qt0Nvj5-Wp4.s38,CD portatile Philips,Alta fedeltà in libertà,-0.462488131089644
Qt0Nvj5-Wp4.s46,Philips Match Line (TV color),"Philips Match Line Darling It's common What else could I do? It's common TV color, I find Philips Match Line More video, more audio Philips Match Line",-0.5584334937893615
Qt0Nvj5-Wp4.s61,sensibilizzazione violenza negli stati Silvio Berlusconi Editore,Un ANYTHING After the original Defend your stadium. Defend our football. Those who love football hate violence.,-4.6890567143758135
qwljPh0e2MQ,Spot Conto Freedom | Maggio 2010 | Ennio Doris (Banca Mediolanum),Sottotitoli e revisione a cura di QTSS Sottotitoli e revisione a cura di QTSS Sottotitoli e revisione a cura di QTSS Sottotitoli e revisione a cura di QTSS,-0.4288076294793023
QxQlrtCF8Qw,Spot Nokia (2003),Sstenstenstenitakutukutakutku Sstenstenstenitakutukutakutku Nuovo telefono cellulare Nokia 7250 con fotocamera integrata. Occhio al futuro.,-0.6113191118427351
Qy9R0wldFwQ,Spot Tim 2003 Kasia Smutniak semi nuda,"Nonna! Nonna, apri! Nonna! Mi scusi signore? Mi scusi, sono rimasta chiusa fuori. Devo salire da lì, lei faccia pure così con le mani. Grazie. Carta Amici T. Tutti gli SMS che vuoi a solo 8 centesimi di euro e tanti MMS gratis. S&P dietro San Valentino. 40 SMS in regalo.",-0.4075772385848196
R5lrKDuuH1k.s14,aspirapolvere Philips Impulse,"Philips Impulse Philips, un poco más, siempre más.",-0.721771776676178
R9nFBwH8v5Y.s3,Scaldasonno Imetec,"Rillami los Scaldasonno Rillanchoooooo Buony, hoy esta con la espela Quinona unos Scaldason",-0.8314051377145868
R9nFBwH8v5Y.s31,Totip,"He got up on his birthday And he went away back to Manila way And the 40 day, yeah, yeah The end of the country, man, just tell me Why do you stand up, gazing in the air? On the straight way, let your song go away He's starting to say, yeah, yeah He's starting to say, yeah, yeah",-0.6617052680567691
RaBfmssjt-o.s20,caramelle Frisk,o Jesus FRISC! Fresqueza Geniale!,-3.269287427266439
RaBfmssjt-o.s5,servizio Chi è Telecom Italia,"Squilla il telefono, legge il numero e Laura, quella che hai conosciuto l'altra sera e che ti piace Ciao piccola, ciao cucciola, pasticcino, ciao piccola, piccola piccola, bella Laura ma stavo leggendo d'ostoglieschi l'idiotta Chi è di Telecom Italia? Il piacere di sapere prima di rispondere Sottotitoli creati dalla comunità Amara.org",-0.3344651401633083
RaBfmssjt-o.s6,Cornetto Algida,Loves like candy on a shelf You wanna taste and help yourself Just help yourself to my lips To my arms and say the word after yours Just help yourself to my lips To my arms and say the word after yours Senza Cornetto l'amore non ha gusto,-0.3839211842370412
rATwcq-TlTc,Spot Zaini Seven Yub 2017,"Zaini Scuola Yub, Urban Instinct. Vai sul sito e scopri come vincere i fantastici premi Samsung.",-0.3571579316083123
REQTbF2QpHk,Giochi Cocorito | Spot Cinema 2015,Советская С вами был Игорь Негода.,-2.6141355832417807
RgYfHljw3-I,Spot 4 salti in padella Findus (2004),"Spot 5 Papo Natale Papo Natale! Entro a preco, io sono 8! E dov'è la cucina 8? Di qua! Oh, oh, oh! Fagottini di pollo con piselli di 4 salti in padella, che ne dici? Fagottini, ahhh! Oh, li e guarda che ripieno! Fondava! E dov'è il mio piatto? Sono 8 e prendo tutto! 8, contali bene! 6! Bravo! E sono miei! Perché ho fatto entrare?",-0.3402993258307962
RleTPjwD2LU,Spot Foot Locker - Sneaker Skills - 2012,Okay You,-0.7056015729904175
rLnNrnBiviw.s27,settimanale Donna Moderna,Donna Moderna,-0.9961748804364886
rMuVHXlHrJk,Spot SKY Summer free Savinio Treno 2007,Sottotitoli creati dalla comunità Amara.org Sottotitoli creati dalla comunità Amara.org,-0.3855326596428366
rnaj0FFNCYw.s2,Fiat Uno,"Uno, que pasión. Uno, que pasión.",-0.8623540878295899
RopppWaSqLs,Primigi e GIOLEN: nuova collezione A/I 2013,Primigi e GIOLEN Calzature e abbigliamento Primigi nei migliori negozi per bambini e in tutti i Primigi Store una avventura straordinaria,-0.4306049346923828
rS96W19VAt8,Spot Coca Cola Estate 2009   Musica  amp  Coca Cola,이후にある bubblesご視聴ありがとうございました,-5.640949249267578
RsJuaRhYvxk.s1,pandoro Bauli,Bauli! Bauli! Bauli! Bauli! Bauli! Bauli!,-0.764085708125945
RtfB3VGL_bA.s3,zaini Seven,Seven No frontiers,-0.8131705284118652
RtfB3VGL_bA.s5,orologi Lorenz,या third eye orology कॉरा हँ यस कodel 우� redist,-2.701141650860126
ruRJqdrdc5A,pubblicità Auto RENAULT MODUS - Canale 5 Mediaset -  spot 2005,"RENAULT MODUS RENAULT MODUS nota con carattere a 10.850 euro finanziamento tasso zero, anticipo zero",-0.605411434173584
ryf0g4xu0qE,Intimissimi lancia lo spot “Il reggiseno perfetto per te”,“Il reggiseno perfetto per te”,-0.5254303216934204
rz1cwccwya4.s11,frigoriferi Hotpoint Ariston,L'atmosfera ideale per i tuoi cibi Quadrio da Hotpoint Ariston,-0.32119852563609247
rz1cwccwya4.s16,pc e chiavetta Alice Mobile Tim,"Porta internet in vacanza con te! Solo con Alice Mobile è un nuovo pc, la chiavetta è 100 euro al mese, tutto incluso a partire da 30 euro. Scopri la libertà di navigare fino a 7 e 2 mega. Tim, tu senza che mi fai male.",-0.49697949993076607
rz1cwccwya4.s27,crema fluida vellutante Nivea Body,I Provate a resistere la bellezza magnetica,-0.8192507028579712
rz1cwccwya4.s47,Wind Summer Collection,"Summer Collection ha soli 9,99 € leite dell'estate, una ricaricabile Wind e 30 € di telefonate gratis verso tutti. Una compilation mostruosa, solo da Wind.",-0.366663138071696
rz1cwccwya4.s59,diario Comix,nel mondo. Comix un mondo da favola e con Comix e Team Trivù vinci un telefonino al giorno per i tuoi amici.,-0.6284717559814453
rz1cwccwya4.s6,Polaretti Fruit Dolfin,"Opo po po polaretti, benvenuti dai pinguini dove inizia la magia Questa patrica è speciale, tutti insieme in allegria Il succo delle arance, delle fragole e limoni, i ghiaccioli polaretti sono unicetti buoni Opo po po polaretti, e in più i polar brilli, collezionaci tutti, ci illuminiamo al buio",-0.2997355229646257
rz1cwccwya4.s81,Nestea,D'Algida Con gusto,-0.8485182523727417
rz1cwccwya4.s88,Polase,della vita. Quando caldo e fatica ti buttano giù scegli la forza del numero uno polase e ti senti subito meglio polase rigenera le tue forze,-0.21980224771702545
rz1cwccwya4.s9,Sony Ericsson W760,Sottotitoli e revisione a cura di QTSS,-0.38860858811272514
