commercial_id,title,transcription,log_prob
ezsouiqSzMk.s22,Gli album dell'uncinetto Fabbri Editori,"Tutti della linea Omino Bianco in regalo un mondo di spugne. Bastano pochi punti. E' un regalo di Omino Bianco. Ah, che meraviglia questa tenda! E' un gioiello di famiglia! Veramente l'ho fatta io con gli album dell'uncinetto.",-0.36175599989000257
F0kQS85PM4s,BMW serie 2 active tourer spot 2014,una chiave per tutto asce BMW serie 2 active tourer scopritela il 27-28 settembre,-0.8190993732876248
f197d7d61e9f4769bac14414fa3d1443_030,Parmalat Grisbi Mister Day Biscotti,"Bicotti ecragen signal Casinando Coccanti cuori, teneri dentro! Biscotti Mr. Day, una gara di freschi sapori.",-5.29044694166917
f3a0aaef91e64dd987bd9de485ef4326_030,Bastoncini Findus Sogg. Pirati,"Capitan Findus, terribili pirati che arrivano dal mar, ma il nostro capitano anche oggi vincerà Datici il vostro L'oro del capitano, eccolo qua Sorridotto, civi del nostro capitano Solo bianco, buon, ernuto, croccante, oro per i miei pirati Bastoncini di Capitan Findus, buon pesce, tanto gusto, tutta parza www.sottotitoli.com",-0.28675297823819246
f3j_NpLs9gE,Profumo Missoni uomo spot 2018,Missoni Parfum Purom,-0.8453912734985352
f52f477945b54ccd8a7c80a6e670aabe_030,Italia Network,"Italia Network Italia Network Italia Network Italia Network Italia Network, un momento tutto latino",-0.8240391943189833
f6c92cb1dcaf4590b7c5bbe6192124de_045,Lega Per L’Emancipazione Degli Handicappati Con Pierangelo Bertoli,Lega Per L’Emancipazione Degli Handicappati Con Pierangelo Bertoli Lega Per L’Emancipazione Degli Handicappati Con Pierangelo Bertoli,-0.3796040461613582
f8b672eafa1540f6a7a2bf3dc37b9b72_030,Fassi Caramelle Flavoral,Everybody come along come along Flavoral Flavoral cambia il mondo da così a così,-0.7847066720326742
f8jte7Xhqg0.s5,Gran Gelato Sammontana,"come hai detto che si chiama? kill me� come hai detto che si chiama? Gran gelato, come hai detto che ci chiama è detto che si chiama gran gelato San Montana come hai detto che si chiama gran gelato san montana gran gelato all'italiana",-1.8716737396863041
f96368a57b174bf2b0105fe0edbdd130_015,Mister Baby,igiene e bellezza secondo Mister Baby Mister Baby in farmacia,-0.7600016593933105
fa9883c91fce4268bcd1f1e0c926f2e9_030,L’Oreal Gamma Studio Line,"Studio, studio, studio, studio line, L’Oreal Tell, scolpisci un nuovo look, pazzi d'edit studio line Spray, sopra, sotto, fisso che studio line Spuma super fix, modella extra forte Studio, studio, studio, studio line Spray design, spritza e crea come vuoi tu Studio line, scolpisci i tuoi capelli",-0.33100636800130206
fad251483435420ca7d5f2ff064be93c_030,Scientel Selectives Balsamo,"Hai aspettato abbastanza per avere i capelli stupendi? Oggi, Scientel Selectives presenta un nuovo balsamo con una speciale formula ionica che agisce solo dove i tuoi capelli ne hanno bisogno e il resto se ne va con un risciacco. I tuoi capelli restano morbidi e naturalmente belli. Nuovi balsami di Scientel Selectives.",-0.2521300551914933
fb3f6bc4112b4b41a2838a6a396c8613_030,Yomo Yogurt Sogg. Marziano,"No, non te lo posso dare questo. Chiedimi quello che vuoi, ma non te lo posso dare. Quarant'anni ci hanno messo a farlo così sano, pulito. Leva quella mano, che cosa sei tu? Una trilha? Un uomo lucerto? Leva! Ti stanno lasciando a piedi. Ti stanno lasciando a piedi. Ecco, hai perso la corriera. Adesso l'arte chissà quando passa. Ma cosa fai piante? Va be', se mi dici dove hai la bocca, te ne do un cucchiaino. Sottotitoli creati dalla comunità Amara.org",-0.2510405102291623
fBVqPY_CogQ,Dolce & Gabbana Classic Spot by Giuseppe Tornatore featuring Monica Bellucci - 2003,Dolce & Gabbana by Giuseppe Tornatore Dolce & Gabbana by Giuseppe Tornatore Dolce & Gabbana by Giuseppe Tornatore,-0.6242045164108276
Fbzw1XfILoc,Spot Geox Kids - 2009,"Geox Geox, la scarpa che respira",-0.7813599109649658
fc118b0ee0d0442aa74d46a7edd65dbe_015,Durex Profilattici Sogg. Pilota,Durex Profilattici,-0.6324118614196778
fcf38007af9f4d1b8aa4dc9d8758c9f8_030,Petrus Boonekamp Amaro,"Petrus Boonekamp Vinheta Medina Deito Hmumbles Isso, Chaison seating consequence... Petrus Bonicamp",-3.967174924653152
fee300bfe22e42e287e8104fb83b5556_030,Lovable Abbigliamento Intimo Femminile,Lovable professionelle Lovable facilita Lovable... che bello essere donna! E in autunno è ancora più bello essere donna con sconti fino a 15.000 lire e su tanti splendidi capi,-1.9248777318883825
FevaPRZCuwc.s9,rasoi Bic,Signor B cosa bisogna fare prima di radasi al mattino? Bisogna sveglia persi! E a questo prrr... Non aggiunga altro ho gia capito vado,-0.9236772977388822
Fgr50GU4XXA.s32,"telefonini i.Tim (con Kasia Smutniak, ♪ Musica: Everywhere - Michelle Branch ♪)",Ma da questo?,-0.7796751431056431
fiBQfvDsnlI.s6,raccolta punti Regalissimi Idee 96 Kinder e Ferrero,Costante Ma ne mangiate molte di merendini a kinder e ferrero ecco bambini figurati e mi regalaresti qualche punto ferma lì sorellina scusa non faceva l'altra colta ma questi sono regalissimi Certo che se mi aiutassi un po svegliati hai tutto il tempo che vuoi ci sono ancora sette mesi Daguzini per kinder e ferrero idee per frullare per tostare idee per grigliare regalissimi 96 fino ad agosto con i punti kinder e ferrero Guarda che ti vedo,-0.3572086177460135
FIPCZNo3yYk,Haier in campo con un nuovo spot per ATP Finals Torino,,
fj8FzWqt07Y,Air Action Vigorsol Chewing Gum - TV Spot 2009,"Air Action Vigorsol, a fresh air explosion. Air Action Vigorsol, a fresh air explosion.",-0.5538392066955566
fkgvFPN92v0.s24,Fisherman's Friend caramelle al mentolo,その手で止まってるわだってフォーティーフィッシャーになるさフォーティー フォーティー フォーティー フォーティーフォーティー フォーケティー フィッシャーマンスフェン,-0.3450851043065389
fkgvFPN92v0.s8,"Fiat Stilo (Location: Bipielle Center - Lodi, ♪ Musica: Vorrei che fosse amore - Mina ♪)","Vorrei che fosse amore, amore è quello vero, la cosa che io sento che mi fa pensare a te. Vorrei che fosse amore, amore è quello vero, la cosa che io sento che mi fa pensare a te.",-0.3196789026260376
FkJvBkOXGxU.s15,linea Nidra al latte,è il momento di Nidra a bagno latte neutro e delicato con le proteine nobili del latte Nidra a bagno latte deterge e distende rinfresca e rende morbida la tena in modo naturale linea Nidra al latte naturalmente neutra linea Nidra al latte,-0.2650184903826032
fMGTuuK94rI,Spot TV PlayStation 2 - Mountain 2004,"The train is coming, I hear it just in time. I hear the cow is moving and it's rumbling through the land. Oh, get on board. Get on board, get on board, get on board. Oh, little children, they're going to get more. She's there and now the station. Oh, center, don't be vain. But come and get your tickets and be ready for this train. Oh, get on board. Get on board, get on board, get on board. Oh, get on board. Little children, they're going to get more.",-0.3971225408118541
FNgd-ARXyr4.s6,Volkswagen Golf GTI,Volkswagen Golf GTI Volkswagen automóviles,-0.5767393112182617
FSD5gn1kEjg.s68,detersivi Spuma di Sciampagna,Spuma di Sciampagna,-0.762795607248942
FSD5gn1kEjg.s69,collezione Sampei Hobby & Work,"Ritorna Sampei, il ragazzo pescatore con le sue fantastiche avventure. Sampei è amore per la pesca e l'avventura, rispetto per la natura e senso dell'amicizia. Inedicola da Hobby & Work.",-0.23346964518229166
FSD5gn1kEjg.s73,cerotti nasali RespiraBene,,
FSD5gn1kEjg.s82,offerte Opel,"Oggi puoi avere tutto e puoi avere il meglio. Solo Opel ti offre di serie su tutta la gamma le SP Plus, il più avanzato sistema di controllo della stabilità consigliato da quattro ruote, Astra, Meriva e Zafira. Il 31 dicembre scadono i massimi incentivi statali, l'esenzione Polo, gli incentivi Opel e il tasso zero. Ora o mai più, i concessionari Opel ti aspettano. Sottotitoli creati dalla comunità Amara.org",-0.20286872607319295
FxA7uWUXnFI,TENA Discreet Protect+ Maxi Campagna 2024 10s IT,Now isn't it time?,-2.7839264339870877
fxfHiLI7UAo,Nuvenia #bloodnormal,"The Scarlet Chariot in Needling Hall, the Pomegranate Molasses. The Scarlet Chariot in Needling Hall, the Pomegranate Molasses. The Scarlet Chariot in Needling Hall, the Pomegranate Molasses. The Scarlet Chariot in Needling Hall, the Pomegranate Molasses. And I pulled out a pad, and it was like I had my own hall pass. Thank you for watching!",-0.6534561243924227
fyRPRpzH1fk,Togo - BRIDGE 2008,"Togo, nuovo Togo Taroon. Cioccolato, cereali e sfoglia croccante. In un appassionante mix.",-0.9668411627048399
g1COU1yGt1o,Spot Sky Contabile 2005,"Sottotitoli creati dalla comunità Amara.org Solo con Sky le emozioni non si contano. Sei proprio sicuro di voler pagare ogni volta tutto quello che vedi? Con un abbonamento Sky, invece, sei libero di scegliere tutto quello che vuoi. Perché solo con Sky le emozioni non si contano.",-0.391907860251034
g2o5qOXjmR0.s18,Ford Escort Voyager,Prendi in largo. Prendi Voyager.,-0.9095092349582248
g2o5qOXjmR0.s20,shampoo toner Studio Line L'Oreal,Studio L'Oreal,-0.7268291711807251
g2o5qOXjmR0.s7,Crodino Crodo,"Per i tuoi momenti d'oro, stappa un Crodino. influenced Rodino",-0.6228127252487909
G7IEx_VVaU8.s14,TV LCD Bravia Sony,To call her hands up up To lean on would have been good enough For me to call her hands up up To lean on would have been good enough To lean on would have been good enough,-0.5713494982038225
G7IEx_VVaU8.s3,Trilogy Un diamante è per sempre DTC,Lei ricorderà sempre questo Natale. Come dipende solo da te. Trilogy Un diamante è per sempre DTC,-0.7596540036408798
gahHjUw98p4,Nuovo SUV Renault Austral E-Tech hybrid - tech control. take control,"Google Play tech control Hey Google, play tech control. Yeah yeah, hey All you want is a piece of mind In a happy place that we all need to find Because you work all day and sleep all night No time for yourself to feel alright Counting the days like 1, 2, 3, 4, 5 Trying to part from darkness to see more light But your manager harassing you to be on time While looking in the mirror like this can't be your life Never feel that your future's wasted When you deal with pursuing greatness If your soul is a damsel, rest on stress cause you can save it Don't let anybody take it from you Stay strong even when they wrong you When you work till you go, know the worth of your soul If you don't then mate, it's on you Know your value and never forget, stay sharp on your path to whatever is next Get a respect when they measure your depth from every breath in your chest Never settle in for anything less Don't let them take all your time You need to take all your time You have to take all your time That's right Don't let them take all your time You need to take all your time You need to take all your time You have to take all your time You need to take all your time You need to take all your time You have to take all your time You need to take all your time You need to take all your time You need to take all your time",-0.750323254129161
GA-YeA75_Yc.s13,Morositas Perfetti,Morositas Morbitadita,-0.9947495460510254
GA-YeA75_Yc.s24,dentifricio Defend Colgate,Defend Colgate,-0.8948131288800921
gb1pLdqJK_k,Spot _ Vari prodotti Dragon Ball Z (2007),www.sottotitoli.com,-0.5567729473114014
gCJ09pp4l-o.s8,Nescafè Nestlè,Nescafè Coffee Nescafè Coffee,-0.8516572316487631
GcSaDmHRV2s.s21,Star Tea,"Testa, una tazza di tè. Una fetta di mondo.",-0.8063784326825824
GcSaDmHRV2s.s22,Sofficini Findus,Cations,-5.250244522094727
GcSaDmHRV2s.s26,profumo Euforia Atkinsons,Euforia Euforia एक खुंटजोसा मौवो दि आटकिंसोंस,-0.6824555397033691
GcSaDmHRV2s.s37,pasta Barilla,stew singer for all your will.,-4.463909149169922
GcSaDmHRV2s.s38,assorbenti Intervallo Lines,Intervallo Lines Intervallo Lines,-0.8454916477203369
GcSaDmHRV2s.s47,liquore Gala Caffè,O Launch Group Gala Caffe Insieme come per magia.,-3.765191591702975
GcSaDmHRV2s.s51,birra Dreher,"Fatima Dreher, c'è più gusto!",-0.7856179646083287
ghtr1vxsdbs.s4,Riso Scotti Oro (con Gerry Scotti),"Piena Mundo Oro, Oro, Oro, quando... Dottor Scotti, due ore di ritardo tranquillo il suo riso non scuocce, e riso Scotti Oro? Oro, Oro, Oro, Oro, quando...",-0.487224851335798
ghtr1vxsdbs.s52,pay-tv Stream,la nuova tv digitale orientala parabola diventate te le indipendenti abbonatevi a stream i primi sei mesi sono gratis per abbonarvi chiamate l' 167 567 665,-0.4266878995028409
ghtr1vxsdbs.s57,Iodosan GolaMed,"Contro il mal di Gola, vittoria sicura, sono medicinari, leggera attentamente il foglio illustrativo.",-0.38647110321942496
GJL4rOSb7a8,POMPEA SPOT - 2002 (MODELLA BELLISSIMA),"Dressi, non stressi. POMPEA. Vestire POMPEA. Non strappa, non stringe, non stressa.",-0.4022933809380782
Gn2ezBtZa9s.s4,Citroen AX First CD,"Regalo Tom, sassofonista. E io sono la regina di Inghilterra. Citroen AX First Compact Disc, l'auto della nuova generazione.",-0.4565588194748451
go9yUpyLIXU,DR5 1.6 GPL - spot con Anna Falchi Aprile 2009,DR5 1.6 GPL Dr5 1.6 GPL,-0.648188304901123
gUb8_ZTT72Y,PlayStation 3 - Assassin's Creed - Spot TV Italia (2007),Windows 8,-3.5810562133789063
gw0rqXiifVM.s22,"Citroen Visa GTI (""Vavavuma"")",Aren't you going to cut facility Only due to cancer... Do not meet your system Take the Lord Daddy. Say feet.,-4.440785283627718
gYjU9CuPwyE,Seat Leon Spot 2005 (PUB ITA),Seat Leon Spot 2005,-0.8721697330474854
H-0qSBLKypM,Nuova Ford Puma ST | Ford Italia,Ford Puma ST Ford Puma ST,-0.9179248128618512
H284aXuUMfI,Spot Sky Fuffy 2005,"Sottotitoli creati dalla comunità Amara.org Mamma! Mamma! Posso venire nel lettone con voi? Papà! Dai, vieni! Posso portare anche Fuffy? Ecco! Porta anche Fuffy! Fuffy! Buonanotte! È bello che tuo figlio sia in buona compagnia. Con 11 canali pensati solo per lui, Sky ti sorprende sempre.",-0.3111680961516966
H2EBA8SaR_4,Musica pubblicità Intimissimi Auguri Natale 2012,Musica pubblicità Intimissimi Auguri Natale 2012 Musica pubblicità Intimissimi Auguri Natale 2012,-0.5306927176082835
h5VDuP1B2hw.s21,892 892,892 892,-0.8510657719203404
h5VDuP1B2hw.s23,Lancia Ypsilon MomoDesign,La nuova lancia Ypsilon MomoDesign è città! La nuova lancia Ypsilon MomoDesign è città!,-0.6261721187167697
h5VDuP1B2hw.s37,Sgrassatore Ultra Ajax Professional,Sgrassatore Ultra Ajax Professional Sgrassatore Ultra Ajax Professional,-0.5085367202758789
h5VDuP1B2hw.s73,RedBull,RedBull ti mette le ali RedBull ti mette le ali,-0.4400009314219157
h5VDuP1B2hw.s75,Pop Corn Maker Ariete,sempre!,-0.8667003631591796
h5VDuP1B2hw.s77,piastra capelli Remington,e vivere.,-0.8713256290980748
h6A-10gTZp0.s4,gas metano Snam,"constant undulating The metal, Tznam, brings it from many countries of the world, with a journey that crosses the sea and the earth in harmony with nature, to make it bloom in our homes, to make life warmer. The clean sky, Tznam, the heart of the metal.",-5.319586617606027
H6EjVg46UPE,Rovagnati. Pronti per voi - spot 2004,Sottotitoli creati dalla comunità Amara.org Rovagnati.,-0.3676404672510484
h9jQ7OLJhTE,Spot Sky Calcio Thinkbig 2005,"Simon FioreAndrieryeon presentation VIN cribbers Chi- closer to uselessness è l'ora dell'allenamento ancora? Bari? Coraggio! Secondo te andrai da titolare? Speriamo, io ce la metto... Riscola! Oh, perchè? Eh, quante storie! È iniziato da molto? Il calcio Sky è sempre più grande! La serie A, tutta la UEFA Champions League e i Mondiali FIFA 2006",-4.484197763296274
HAVj90EP8dg,Introducing the All-New Lexus LBX,"answering Space For my body Push the sides apart, this is what I'm controlling It's the mold, the inside that I carve This will be my monument This will be the beacon when I'm gone Gone, gone, when I'm gone Gone, gone, when I'm gone So that when the moment comes I can say I did it Now with love, love, love, love With love, love, love With love, love, love, love With love, love, love, love With love, love, love, love",-3.862576411320613
hBH464YrhGQ.s13,collant Golden Lady,"Golden Lady, grande amica",-0.47217681672837997
h-Ec6F5WTVM.s7,Martini Rosso,"They say opposites always attract You can see that it must be a fact Look at you, look at me, and that's what you'll see It's not what I do, it's more what I don't It's the things that you will, the things that I won't Where's the attraction? The bittersweet satisfaction? Is it that both of us know how Martini Rosso?",-0.15024167072923877
HgKvI07MQLo,Spot Pubblicita Audi A3 Sportback Raiuno 2008,A3 Sportback Raiuno 2008 www.file-file.com,-0.7520154317220052
HGYrMqC9X6A,Spot 206 SW - Peugeot - 2002,Scoprite la sabato 14 e domenica 15. Scoprite la sabato 14 e domenica 15.,-0.7230446338653564
h-I2QT5tWhI,PlayStation 3 - PlayStation Move - Spot TV 1 Italia (2010),"È arrivato PlayStation Move. Vivi una nuova esperienza di gioco con PlayStation 3. Accendi il controller, divertiti con la tua famiglia, con i tuoi amici e diventa il protagonista dell'azione. Con PlayStation Move sei al centro del divertimento. PlayStation 3 è ancora di più. Guarda i film in HD e scopri la magia del 3D. PlayStation 3, il gioco è solo l'inizio. Sottotitoli creati dalla comunità Amara.org",-0.14414041130631058
HI9XKImYBGQ,Spot Pubblicita Renault Clio   Italia1 2003,Renault Clio   Italia1 2003,-0.6291031837463379
HIWrColx9Sw.s2,gioielli oro Gold Market - Milano,Orro momenti d'amore momenti gold market gold market nella via dei transiti mm pasteur Milano,-0.4174799919128418
HktvMN5SU-4,Spot - Breil Milano(confessionale) - Novembre 2006,"Love, Love, Love, Love and War Love, Love, Love, Love and War",-0.879328727722168
HM_yatB9YIs.s21,antigelo Paraflu Fiat,"Paraflu è solo Fiat, fatemi rispettare.",-0.48661984337700737
HM_yatB9YIs.s26,profumo Armani,Okay.,-0.9911911964416504
HM_yatB9YIs.s39,Pandoro Bauli,Bauli,-0.7825879573822021
HM_yatB9YIs.s46,profumi Trussardi,ڈو ساردی پیدافہ,-0.9222235083580017
HM_yatB9YIs.s54,autoradio Pioneer,Completely 真的,-6.244462966918945
HM_yatB9YIs.s57,Simac,.,-0.3987065851688385
hmXdOejBqe0.s2,rasoi Gillette SensorExcel,"Gillette presenta Sensor, il nuovo sistema, la nuova tecnologia che cambierà il tuo modo di raderti per sempre. Le due lame di sensor sono montate su molle straordinariamente sensibili e ciascuna sente in ogni momento le caratteristiche uniche del tuo riso e ti si adatta automaticamente. Nessun altro rasoio rade più a fondo. Il nuovo rivoluzionario Gillette Sensor, la rasatura migliore che un uomo possa ottenere. Sottotitoli creati dalla comunità Amara.org",-0.1348512034770871
hmXdOejBqe0.s35,scarpe Nike Air 180,"Dinto, Dinto, ¿estás bien? ¿Estás bien? Por favor, hay una pesca suave aquí.",-0.9344838261604309
hmXdOejBqe0.s39,scarpe Nike air trainer E,Oh,-0.8618189692497253
hmXdOejBqe0.s43,linea scuola Top Gun Auguri Mondadori,Scopi la supersonica linea Top Gun nelle milioni cartolerie!,-0.5539435886201405
hmXdOejBqe0.s5,Renault 21,Renault 21 Voglia di vederla,-0.7028967312404087
hmXdOejBqe0.s8,Neo Nisidina De Angeli (trattamento di mal di testa),Nel Nisidina per dimenticare il mal di testa. Evitare l'uso prolungato può avere effetti collaterali. Leggere attentamente le vertezze.,-0.4560593729433806
Hn1aG9RMrbs.s5,Tele2,Canone Telecom? No grazie! Da oggi su Rete Tele2 a partire da meno di 9 euro al mese fai urbane interurbane illimitate e non paghi il Canone Telecom! Canone Telecom? No no grazie! Chiamatele 2 al 19 22,-0.32280635833740234
Hob_yJfaHqc.s34,acqua Sangemini (♪ Musica: Barbara Ann  - Beach Boys ♪),"Sangemini, salute!",-0.9372968673706055
Hob_yJfaHqc.s81,ammorbidente Ver Nel 3 (con Ferruccio Amendola),"Un vernel 3 è tre volte concentrato, così ogni tappo vale ben tre tappe di vernel normale. E allora? Giusto lei! Era ora! Proprio comodo il vernel 3, un flaconcino così piccolo, con dentro così tanta morbidezza. La morbidezza è imbattibile di vernel? E' un po' spesso, ma a me è un po' più. Allora, come stai? Mi piace, come stai? Mi piace, mi piace. Mi piace, mi piace. Mi piace, mi piace. Mi piace, mi piace. Mi piace, mi piace. Questo l'avrei detto io. Beh...",-0.9196621981534091
Hs0ZsUWS-Mo.s5,stampanti Canon,How to Grandma's bloody screw up,-4.841319274902344
HsRsH6nE6-4.s2,mensile Tutto,"Tutto, la rivista che non finisce mai, questo è il mio libro. Questo mese ti da doppio popter, baglioni e gli haha, gli urop e hour jump, il sandremo che piace a noi. Ogni mese se vuoi tutto, prendi tutto.",-0.8882845015752883
hZ4iFrmFI1o,"Spot ""Fiat"" (con Francesco Totti - 2002)","Stop perfetto di Bobo Ieri Vieni su per un avversario 2, 3, vieni in area sabile Seribili agilmente l'ultimo difensore Vieni, tira, faro Ma arriva Totti Goal! Totti! Un fuori classe Ama vivere grandi emozioni Anche quando guida Watch out! Sottotitoli creati dalla comunità Amara.org",-0.5516680923162722
hzfqEkvlGxk.s5,Land Rover Freelander,The last flagohhh obligation First guts,-6.974567413330078
i13TYeynKCk.s20,succhi di frutta G,frutta la frutta frutta la frutta frutta la frutta bravo! sfrutta la frutta! bravo! sfrutta la frutta dei succhi G,-0.7104364122663226
i13TYeynKCk.s29,Adidas,A wouldn't it...,-3.7944846153259277
i13TYeynKCk.s9,mensile Class,"Clas, clas se perdirge. Clas, il mensile de la clas. Clas, clas se perdirge. Clas, il mensile de la clas.",-0.810931396484375
i6cw0KNIQPQ,Air Action Vigorsol Spot  2013,Gain HPs and Use movement speed. Gain θαρ curdSAB. Ah! Air Action Figurusel. A fresh air explosion.,-5.133274396260579
I8vDSHlRVII,Spot NOW (Sky) - agosto 2021,"7 full feet Spotietnam Hai calcio, motori, tennis, basket e tutto lo sport di Sky in streaming. I tuoi sport, la nostra passione.",-2.4915871620178223
I9Sq4nCFcDs.s11,Aspirina03 Bayer,Aspirina03 Bayer Aspirina03 Bayer Aspirina03 Bayer Aspirina03 Bayer Aspirina03 Bayer Aspirina03 Bayer Aspirina03 Bayer Aspirina03 Bayer Aspirina03 Bayer Aspirina03 Bayer Aspirina03 Bayer Aspirina03 Bayer Aspirina03 Bayer Aspirina03 Bayer Aspirina03 Bayer Aspirina03 Bayer Aspirina03 Bayer Aspirina03 Bayer Aspirina03 Bayer Aspirina03 Bayer Aspirina03 Bayer Aspirina03 Bayer Aspirina03 Bayer Aspirina03 Bayer Aspirina03 Bayer Aspirina03 Bayer Aspirina03 Bayer Aspirina03 Bayer Aspirina03 Bayer,-0.8494901657104492
iEclJxSVJZQ,Spot nuova gamma Audi A3 - 2013,faster That 디對啊 Sandy Drink street headquarters you,-6.360887145996093
if0P1MxVNVI.s31,Alfa Romeo 159 (♪ Musica: Roads - Portishead ♪),"Oh, can't anybody see? The story of a lonely man I feel no more How can it feel this way? How can it feel this way?",-0.5996596018473307
iflXLg8bkNs.s3,gelati Prestige Sanson,"Prestige Sanson, tanto buono che ti commuoi",-0.3069964051246643
IHN0xUkgrqY.s48,trattori Same,"Trattori Same, Lamborghini, Urliman, il gruppo Same, 60 anni di tecnologia, Sì, ai potenzi",-0.4797664483388265
IHN0xUkgrqY.s49,Prosecco Maschio,"Il film è finito! Il film è finito! Prosecco Maschio Più che un rito, un piacere infinito",-0.8879195213317871
IHN0xUkgrqY.s8,One-o-one Sanpellegrino,Cento pollicine e una stella da Sanpellegrino One-o-one,-0.39308354729100276
IhpcIZmvK1o,Profumo Coco Chanel pubblicità spot 2019,dribble dribble dribble Eau de perfume intense Coco M.-C. Chanel,-2.4330500941122732
IHr02OkaB0g,Audi House of Progress at Milano Design Week 2022 | Audi Italia,Barcelona football match,-3.9304189682006836
IOHmIjJxtjo,📺 Spot Sky Calcio 2012/2013: Emozioni Illimitate sul Campo! ⚽🥅 | Pubblicità TV,⚽🥅 ⚽🥅 ⚽🥅 ⚽🥅 ⚽🥅 ⚽🥅 ⚽🥅 ⚽🥅 ⚽🥅 ⚽🥅 ⚽🥅 ⚽🥅 ⚽🥅 ⚽🥅 ⚽🥅 ⚽🥅 ⚽🥅 ⚽🥅 ⚽🥅 ⚽🥅 ⚽🥅 ⚽🥅 ⚽🥅 ⚽🥅 ⚽🥅 ⚽🥅 ⚽🥅 ⚽🥅 ⚽🥅 ⚽🥅 ⚽🥅 ⚽🥅 ⚽🥅 ⚽🥅 ⚽🥅 ⚽🥅 ⚽🥅 � ⚽🥅 ⚽🥅 ⚽🥅 ⚽🥅 ⚽🥅 ⚽🥅 ⚽🥅 ⚽🥅 ⚽🥅 ⚽🥅 ⚽🥅 ⚽🥅 ⚽🥅 ⚽🥅 ⚽🥅 ⚽🥅 ⚽🥅 ⚽🥅 ⚽🥅 ⚽🥅 ⚽🥅 ⚽🥅 ⚽🥅 ⚽🥅 ⚽🥅 ⚽🥅 ⚽🥅 ⚽🥅 ⚽🥅 ⚽🥅 ⚽🥅 ⚽🥅 ⚽🥅 ⚽🥅 ⚽🥅 ⚽🥅 ⚽�,-0.09787754482693142
IoJ3B7EMHqw.s13,linea Match Line Philips,"DOLLY DOLLY DOLLY Cosa altro potrei fare? TV color i fi Philips Match Line Più video, più audio Philips Match Line",-0.6694011314242494
IoJ3B7EMHqw.s15,zaini Invicta,Invicta Tuta la libertad,-0.7954663549150739
IoJ3B7EMHqw.s19,viaggi Marlboro Country,Music,-0.9236915111541748
IP10PFS0xzo,“La forza delle cose semplici “ - Spot Sole 2019,Una camicia bianca per me funziona sempre Da bambina mi faceva sentire la più elegante di tutte Semplicemente me stessa per quel primo appuntamento e poi una mamma pronta per ogni grande abbraccio Funziona perché è semplice come sole Grazie alla sua formula con bicarbonato e olio di argan Ingredienti semplici espirati alla natura sole fa splendere tutti i capi sole la forza delle cose semplici,-0.21481186548868816
iSBMsdpXWx4,Mutti: ecco lo spot dedicato alle zuppe on air in occasione di Sanremo 2024,"Ivan, BMX VOля iste",-6.965951283772786
ixX9ptbPurk,Spot tv Camomilla - Camomilla Shoes - autunno 2009,Sottotitoli e revisione a cura di QTSS Sottotitoli e revisione a cura di QTSS,-0.5169000095791287
iY2OOMIql14.s44,Magnum Algida,Magnum Algida Magnum Algida Magnum Algida Live,-0.7230279445648193
iY2OOMIql14.s59,Citroen Xsara Picasso (♪ Musica: Sympathique - Pink Martini ♪),Citroen Xsara Picasso Citroen Xsara Picasso,-0.6963194847106934
iY2OOMIql14.s60,Gatorade,Gatorade,-0.7828797499338785
iyh2ERhZiwc,"Spot nuova Volkswagen Golf ""Das Auto"" - 2012",Golf. Das Auto. Das Auto.,-0.7746924161911011
j_UACIEWDto,Zegna profumo for man Spot 2013,Walmo the new fragrance from our men a Gildo Zegna,-0.7418800459967719
j1Jn9wZSA68,SPOT YARIS HYBRID  2017 italiano/italian aprile 2017,spost yaris hybrids  l'ibrido contagia la città ad aprile ti aspettiamo agli hybrid days,-0.8185035871422809
j-1Ygm4hkeU,Spot _ Nokia N-Gage (2003),T dignder deepest Engage.,-6.207701206207275
J756EaHEiHA.s5,spumante Asti Martini,"Brilla Asti Martini, brilla la vita.",-0.503290057182312
